{
  "$schema": "http://json-schema.org/draft-07/schema#",
  "title": "Energo Sustainability Report Input",
  "type": "object",
  "properties": {
    "company": { "type": "string" },
    "reportYear": { "type": "integer" },
    "title": { "type": "string" },
    "executiveSummary": { "type": "string" },
    "kpis": { "type": "array" },
    "segments": { "type": "array" },
    "imageCards": { "type": "array" }
  },
  "required": ["company", "reportYear"]
}